Ref;Usuario;CV;Motivación;Fecha;Oferta;Video
Pos1;lgarcia;"Licenciada en Administración: experiencia en gestión de equipos y proyectos. Conocimientos en Microsoft Office.";Estoy emocionada por la oportunidad de formar parte de un equipo dinámico y contribuir con mis habilidades de liderazgo.;01/10/2023;Desarrollador Frontend;https://www.youtube.com/embed/sqh77QZS0G4
Pos2;matilo;"Estudiante de Comunicación: habilidades en redacción y manejo de redes sociales. Experiencia en prácticas en medios locales.";Me encantaría formar parte de un equipo que me permita desarrollar mis habilidades en comunicación y marketing.;30/09/2023;Estratega de Negocios;https://www.youtube.com/embed/ekm1D3sKoVA
Pos3;maro;"Ingeniero en Sistemas: experiencia en desarrollo web y aplicaciones móviles. Conocimientos en JavaScript y React.";Me entusiasma la posibilidad de trabajar en proyectos desafiantes y seguir creciendo como profesional en el campo de la tecnología.;02/10/2023;Desarrollador Frontend;SV
Pos4;javierf;"Técnico en Electricidad: experiencia en mantenimiento industrial. Conocimientos en lectura de planos eléctricos.";Estoy interesado en formar parte de un equipo que me permita aplicar mis habilidades técnicas y contribuir al mantenimiento eficiente.;30/10/2023;Diseñador UX/UI;https://www.youtube.com/embed/uNCzhfQCqAs
Pos5;valen25;"Músico profesional: experiencia en espectáculos en vivo. Habilidades en canto y guitarra.";Me gustaría combinar mi pasión por la música con una oportunidad laboral que me permita seguir creciendo como artista.;30/09/2023;Estratega de Negocios;https://www.youtube.com/embed/jwiV9gbjEi8
Pos6;lgarcia;"Licenciada en Administración: me considero genia, experiencia en gestión de equipos y proyectos. Conocimientos en Microsoft Office.";Estoy emocionada por la oportunidad de formar parte de un equipo dinámico y contribuir con mis habilidades de liderazgo.;02/10/2023;Estratega de Negocios;SV
Pos7;lgarcia;Licenciada en Administración, me considero la mejor menejadora de contenidos del mundo, tengo experiencia en gestión de equipos y proyectos. Conocimientos en Microsoft Office.;Estoy emocionada por la oportunidad de formar parte de un equipo tan bonito y contribuir con mis habilidades de liderazgo.;21/10/2023;Content Manager;SV
Pos8;valen25;Me manejo las redes, tengo 20M de seguidores.;Me gustaría combinar mi pasión por la música con una oportunidad laboral que me permita seguir creciendo como artista.;22/10/2023;Content Manager;https://www.youtube.com/embed/jwiV9gbjEi8